<?xml version="1.0" encoding="UTF-8"?>
<!--Sample XML file generated by XMLSpy v2008 rel. 2 sp2 (http://www.altova.com)-->
<tns:resourceElements tns:patientId="default" xsi:schemaLocation="model.consenteditor.srdc.com.tr schemas\ConsentModel.xsd" xmlns:xsi="http://www.w3.org/2001/XMLSchema-instance" xmlns:tns="model.consenteditor.srdc.com.tr">
    <tns:resourceElement>
        <tns:id>RESOURCECODE:ALLERGY</tns:id>
        <tns:name>Allergies</tns:name>        
        <tns:confidentialityCode>ALL</tns:confidentialityCode>        
    </tns:resourceElement>
    <tns:resourceElement>
        <tns:id>RESOURCECODE:CONDITION</tns:id>
        <tns:name>Conditions</tns:name>        
        <tns:confidentialityCode>ALL</tns:confidentialityCode>        
    </tns:resourceElement>
    <tns:resourceElement>
        <tns:id>RESOURCECODE:OPERATION</tns:id>
        <tns:name>Operations</tns:name>
        <tns:confidentialityCode>ALL</tns:confidentialityCode>
    </tns:resourceElement>
    <tns:resourceElement>
        <tns:id>RESOURCECODE:MEDICATION</tns:id>
        <tns:name>Medications</tns:name>        
        <tns:confidentialityCode>ALL</tns:confidentialityCode>
    </tns:resourceElement>
    <tns:resourceElement>
        <tns:id>RESOURCECODE:TESTRESULT</tns:id>
        <tns:name>Test Results</tns:name>        
        <tns:confidentialityCode>ALL</tns:confidentialityCode>
    </tns:resourceElement>
    <tns:resourceElement>
        <tns:id>RESOURCECODE:IMMUNIZATION</tns:id>
        <tns:name>Immunizations</tns:name>
        <tns:confidentialityCode>ALL</tns:confidentialityCode>
    </tns:resourceElement>
    <tns:resourceElement>
        <tns:id>RESOURCECODE:HOSPITALVISIT</tns:id>
        <tns:name>Hospital Visit</tns:name>
        <tns:confidentialityCode>ALL</tns:confidentialityCode>
    </tns:resourceElement>
    <tns:resourceElement>
        <tns:id>RESOURCECODE:BASICHEALTH</tns:id>
        <tns:name>Basic Health Information</tns:name>
        <tns:confidentialityCode>ALL</tns:confidentialityCode>
    </tns:resourceElement>
</tns:resourceElements>